{
  "id": "char_1001",
  "name": "Jonathan Reed",
  "playerName": "Alice Smith",
  "type": "PC",
  "age": 35,
  "gender": "Male",
  "occupation": "Private Investigator",
  "birthplace": "Boston, Massachusetts",
  "residence": "New York City, New York",
  "attributes": {
    "str": 60,
    "con": 55,
    "siz": 65,
    "dex": 70,
    "app": 50,
    "int": 75,
    "pow": 65,
    "edu": 80,
    "luck": 55
  },
  "skills": {
    "Accounting": {
      "name": "Accounting",
      "hasSucceeded": false,
      "basePoint": 25,
      "occupationPoint": 0,
      "interestPoint": 0,
      "growthPoint": 0
    },
    "Animal Handling": {
      "name": "Animal Handling",
      "hasSucceeded": false,
      "basePoint": 20,
      "occupationPoint": 0,
      "interestPoint": 0,
      "growthPoint": 0
    },
    "Anthropology": {
      "name": "Anthropology",
      "hasSucceeded": false,
      "basePoint": 15,
      "occupationPoint": 0,
      "interestPoint": 0,
      "growthPoint": 0
    },
    "Appraise": {
      "name": "Appraise",
      "hasSucceeded": false,
      "basePoint": 20,
      "occupationPoint": 0,
      "interestPoint": 0,
      "growthPoint": 0
    },
    "Archaeology": {
      "name": "Archaeology",
      "hasSucceeded": false,
      "basePoint": 15,
      "occupationPoint": 0,
      "interestPoint": 0,
      "growthPoint": 0
    },
    "Art and Craft": {
      "name": "Art and Craft",
      "hasSucceeded": false,
      "basePoint": 30,
      "occupationPoint": 0,
      "interestPoint": 0,
      "growthPoint": 0
    },
    "Artillery": {
      "name": "Artillery",
      "hasSucceeded": false,
      "basePoint": 15,
      "occupationPoint": 0,
      "interestPoint": 0,
      "growthPoint": 0
    },
    "Charm": {
      "name": "Charm",
      "hasSucceeded": false,
      "basePoint": 25,
      "occupationPoint": 0,
      "interestPoint": 0,
      "growthPoint": 0
    },
    "Climb": {
      "name": "Climb",
      "hasSucceeded": false,
      "basePoint": 50,
      "occupationPoint": 0,
      "interestPoint": 0,
      "growthPoint": 0
    },
    "Computer Use": {
      "name": "Computer Use",
      "hasSucceeded": false,
      "basePoint": 30,
      "occupationPoint": 0,
      "interestPoint": 0,
      "growthPoint": 0
    },
    "Credit Rating": {
      "name": "Credit Rating",
      "hasSucceeded": false,
      "basePoint": 0,
      "occupationPoint": 0,
      "interestPoint": 0,
      "growthPoint": 0
    },
    "Cthulhu Mythos": {
      "name": "Cthulhu Mythos",
      "hasSucceeded": false,
      "basePoint": 0,
      "occupationPoint": 0,
      "interestPoint": 0,
      "growthPoint": 0
    },
    "Demolitions": {
      "name": "Demolitions",
      "hasSucceeded": false,
      "basePoint": 15,
      "occupationPoint": 0,
      "interestPoint": 0,
      "growthPoint": 0
    },
    "Disguise": {
      "name": "Disguise",
      "hasSucceeded": false,
      "basePoint": 25,
      "occupationPoint": 0,
      "interestPoint": 0,
      "growthPoint": 0
    },
    "Diving": {
      "name": "Diving",
      "hasSucceeded": false,
      "basePoint": 40,
      "occupationPoint": 0,
      "interestPoint": 0,
      "growthPoint": 0
    },
    "Dodge": {
      "name": "Dodge",
      "hasSucceeded": false,
      "basePoint": 40,
      "occupationPoint": 0,
      "interestPoint": 0,
      "growthPoint": 0
    },
    "Drive Auto": {
      "name": "Drive Auto",
      "hasSucceeded": false,
      "basePoint": 50,
      "occupationPoint": 0,
      "interestPoint": 0,
      "growthPoint": 0
    },
    "Electrical Repair": {
      "name": "Electrical Repair",
      "hasSucceeded": false,
      "basePoint": 25,
      "occupationPoint": 0,
      "interestPoint": 0,
      "growthPoint": 0
    },
    "Electronics": {
      "name": "Electronics",
      "hasSucceeded": false,
      "basePoint": 30,
      "occupationPoint": 0,
      "interestPoint": 0,
      "growthPoint": 0
    },
    "Fast Talk": {
      "name": "Fast Talk",
      "hasSucceeded": false,
      "basePoint": 35,
      "occupationPoint": 0,
      "interestPoint": 0,
      "growthPoint": 0
    },
    "Fighting": {
      "name": "Fighting",
      "hasSucceeded": false,
      "basePoint": 40,
      "occupationPoint": 0,
      "interestPoint": 0,
      "growthPoint": 0
    },
    "Firearms": {
      "name": "Firearms",
      "hasSucceeded": false,
      "basePoint": 40,
      "occupationPoint": 0,
      "interestPoint": 0,
      "growthPoint": 0
    },
    "First Aid": {
      "name": "First Aid",
      "hasSucceeded": false,
      "basePoint": 40,
      "occupationPoint": 0,
      "interestPoint": 0,
      "growthPoint": 0
    },
    "History": {
      "name": "History",
      "hasSucceeded": false,
      "basePoint": 25,
      "occupationPoint": 0,
      "interestPoint": 0,
      "growthPoint": 0
    },
    "Hypnosis": {
      "name": "Hypnosis",
      "hasSucceeded": false,
      "basePoint": 15,
      "occupationPoint": 0,
      "interestPoint": 0,
      "growthPoint": 0
    },
    "Intimidate": {
      "name": "Intimidate",
      "hasSucceeded": false,
      "basePoint": 35,
      "occupationPoint": 0,
      "interestPoint": 0,
      "growthPoint": 0
    },
    "Jump": {
      "name": "Jump",
      "hasSucceeded": false,
      "basePoint": 50,
      "occupationPoint": 0,
      "interestPoint": 0,
      "growthPoint": 0
    },
    "Language (Own)": {
      "name": "Language (Own)",
      "hasSucceeded": false,
      "basePoint": 50,
      "occupationPoint": 0,
      "interestPoint": 0,
      "growthPoint": 0
    },
    "Law": {
      "name": "Law",
      "hasSucceeded": false,
      "basePoint": 20,
      "occupationPoint": 0,
      "interestPoint": 0,
      "growthPoint": 0
    },
    "Library Use": {
      "name": "Library Use",
      "hasSucceeded": false,
      "basePoint": 40,
      "occupationPoint": 0,
      "interestPoint": 0,
      "growthPoint": 0
    },
    "Listen": {
      "name": "Listen",
      "hasSucceeded": false,
      "basePoint": 50,
      "occupationPoint": 0,
      "interestPoint": 0,
      "growthPoint": 0
    },
    "Locksmith": {
      "name": "Locksmith",
      "hasSucceeded": false,
      "basePoint": 30,
      "occupationPoint": 0,
      "interestPoint": 0,
      "growthPoint": 0
    },
    "Lore": {
      "name": "Lore",
      "hasSucceeded": false,
      "basePoint": 10,
      "occupationPoint": 0,
      "interestPoint": 0,
      "growthPoint": 0
    },
    "Mechanical Repair": {
      "name": "Mechanical Repair",
      "hasSucceeded": false,
      "basePoint": 25,
      "occupationPoint": 0,
      "interestPoint": 0,
      "growthPoint": 0
    },
    "Medicine": {
      "name": "Medicine",
      "hasSucceeded": false,
      "basePoint": 25,
      "occupationPoint": 0,
      "interestPoint": 0,
      "growthPoint": 0
    },
    "Natural World": {
      "name": "Natural World",
      "hasSucceeded": false,
      "basePoint": 25,
      "occupationPoint": 0,
      "interestPoint": 0,
      "growthPoint": 0
    },
    "Navigate": {
      "name": "Navigate",
      "hasSucceeded": false,
      "basePoint": 30,
      "occupationPoint": 0,
      "interestPoint": 0,
      "growthPoint": 0
    },
    "Occult": {
      "name": "Occult",
      "hasSucceeded": false,
      "basePoint": 15,
      "occupationPoint": 0,
      "interestPoint": 0,
      "growthPoint": 0
    },
    "Operate Heavy Machinery": {
      "name": "Operate Heavy Machinery",
      "hasSucceeded": false,
      "basePoint": 20,
      "occupationPoint": 0,
      "interestPoint": 0,
      "growthPoint": 0
    },
    "Persuade": {
      "name": "Persuade",
      "hasSucceeded": false,
      "basePoint": 35,
      "occupationPoint": 0,
      "interestPoint": 0,
      "growthPoint": 0
    },
    "Pilot": {
      "name": "Pilot",
      "hasSucceeded": false,
      "basePoint": 40,
      "occupationPoint": 0,
      "interestPoint": 0,
      "growthPoint": 0
    },
    "Psychoanalysis": {
      "name": "Psychoanalysis",
      "hasSucceeded": false,
      "basePoint": 15,
      "occupationPoint": 0,
      "interestPoint": 0,
      "growthPoint": 0
    },
    "Psychology": {
      "name": "Psychology",
      "hasSucceeded": false,
      "basePoint": 25,
      "occupationPoint": 0,
      "interestPoint": 0,
      "growthPoint": 0
    },
    "Read Lips": {
      "name": "Read Lips",
      "hasSucceeded": false,
      "basePoint": 15,
      "occupationPoint": 0,
      "interestPoint": 0,
      "growthPoint": 0
    },
    "Ride": {
      "name": "Ride",
      "hasSucceeded": false,
      "basePoint": 30,
      "occupationPoint": 0,
      "interestPoint": 0,
      "growthPoint": 0
    },
    "Science": {
      "name": "Science",
      "hasSucceeded": false,
      "basePoint": 20,
      "occupationPoint": 0,
      "interestPoint": 0,
      "growthPoint": 0
    },
    "Sleight of Hand": {
      "name": "Sleight of Hand",
      "hasSucceeded": false,
      "basePoint": 35,
      "occupationPoint": 0,
      "interestPoint": 0,
      "growthPoint": 0
    },
    "Spot Hidden": {
      "name": "Spot Hidden",
      "hasSucceeded": false,
      "basePoint": 40,
      "occupationPoint": 0,
      "interestPoint": 0,
      "growthPoint": 0
    },
    "Stealth": {
      "name": "Stealth",
      "hasSucceeded": false,
      "basePoint": 40,
      "occupationPoint": 0,
      "interestPoint": 0,
      "growthPoint": 0
    },
    "Survival": {
      "name": "Survival",
      "hasSucceeded": false,
      "basePoint": 25,
      "occupationPoint": 0,
      "interestPoint": 0,
      "growthPoint": 0
    },
    "Swim": {
      "name": "Swim",
      "hasSucceeded": false,
      "basePoint": 50,
      "occupationPoint": 0,
      "interestPoint": 0,
      "growthPoint": 0
    },
    "Throw": {
      "name": "Throw",
      "hasSucceeded": false,
      "basePoint": 30,
      "occupationPoint": 0,
      "interestPoint": 0,
      "growthPoint": 0
    },
    "Track": {
      "name": "Track",
      "hasSucceeded": false,